,Calculated variables,Type(Stoichiometric),,,,,
"Display_MsatSSO4,KSO4,BIO",Sulphate availability (Monod saturation function),-1,-1,unitless,2,GenThreePondModel,
"Display_MinhpHHNO2,AOB",Nitrous acid inhibition (Monod saturation function),-1,-1,unitless,2,GenThreePondModel,
"Display_MinhpHNH3,NITO",Un-ionized ammonia inhibition (Monod saturation function),-1,-1,unitless,2,GenThreePondModel,
"Display_BellinhpH,AOB",pH inhibition function,-1,-1,unitless,2,GenThreePondModel,
"Display_MsatSALK,KALK",Alkalinity availability (Monod saturation function),"MsatSALK,KALK",0.75,-,2,GenThreePondModel,
,,,,,,,
,Algal kinetics - pond model,Type(Kinetic),,,,,
Symbol,Name,Expression,Value,Unit,Decimals,Rule,Principle/comment
"Display_?ALGAE,T",Algal specific growth rate (temperature corrected),"?ALGAE,T",2,d-1,2,GenThreePondModel,
Display_XALGAE,Algal concentration,XALGAE,0,g COD.m-3,2,GenThreePondModel,
"Display_MsatSCO2,KCO2,ALGAE",CO2 availability (Monod saturation function),-1,-1,unitless,2,GenThreePondModel,
Display_LightSwitch,Light availability function,LightSwitch,7.81835E-42,-,2,GenThreePondModel,
"Display_MsatSNOx,KNOx,ALGAE",Nitrate availability (Monod saturation function),"MsatSNOx,KNOx,ALGAE",0.967741935,-,2,GenThreePondModel,
"Display_MinhSNHx,KiNHx,ALGAE",Ammonia inhibition of nitrate assimilation (Monod saturation function),"MinhSNHx,KiNHx,ALGAE",0.142857143,-,2,GenThreePondModel,
"Display_MsatSNHx,KNHx,ALGAE",Ammonia availability (Monod saturation function),"MsatSNHx,KNHx,ALGAE",0.810810811,-,2,GenThreePondModel,
